{
  "schemaVersion": 1,
  "parentIssue": 216,
  "batchIssue": 298,
  "runtime": {
    "observedAt": "2026-05-14",
    "beyondVersion": "BEYOND 2030",
    "operatorSupervised": true,
    "noLaserConnected": true,
    "notes": "Local BEYOND runtime on 127.0.0.1:16062 with OSC callbacks on 0.0.0.0:7000. The probe used the same FB3 hardware root while connected and after operator-supervised disconnect. The normalized public object path redacts the serial-bearing root."
  },
  "entries": [
    {
      "objectPath": "FB3_XXXXX.Connected",
      "probePath": "FB3_XXXXX.Connected",
      "probeMode": "readback-only",
      "shipsMetadata": true,
      "valueType": "boolean",
      "evidenceLevel": "observed",
      "boundaryBehavior": "unknown",
      "baseline": {
        "value": 1,
        "typeTag": "i"
      },
      "valueRange": {
        "min": 0,
        "max": 1,
        "unit": "boolean",
        "minInclusive": true,
        "maxInclusive": true
      },
      "acceptedValues": [
        {
          "value": 0,
          "label": "DISCONNECTED",
          "description": "FB3_XXXXX.Connected reads disconnected."
        },
        {
          "value": 1,
          "label": "CONNECTED",
          "description": "FB3_XXXXX.Connected reads connected."
        }
      ],
      "testedValues": [
        {
          "input": "connected-state readback",
          "readback": 1,
          "behavior": "pass-through"
        },
        {
          "input": "disconnected-state readback",
          "readback": 0,
          "behavior": "pass-through"
        }
      ],
      "restore": {
        "strategy": "not-needed",
        "notes": "Readback-only hardware connection probe sent no writes. Operator disconnected FB3 before the disconnected-state readback."
      },
      "evidenceNote": "Runtime readback-only evidence on 2026-05-14 issue #298 confirmed FB3_XXXXX.Connected as a 0/1 hardware connection domain. The connected state read 1, then the same FB3 hardware root read 0 after operator-supervised disconnect.",
      "locationAware": true,
      "locationContext": {
        "kind": "hardware-instance",
        "populationDependent": true,
        "concreteContext": "FB3 hardware root with serial-bearing name redacted",
        "notes": "FB3_XXXXX redacts the concrete FB3 hardware root name in public metadata."
      }
    }
  ]
}
